ID,Ref,RefrenceInTechnicalReport,RefrenceURL,Country,RansomwareName,RansomwareType,Group,Sector,SectorDetailed,Description,ArticleDate,AttackDate
82,[83],N/A,https://www.freightwaves.com/news/breaking-news-tfi-ransomware-attack-hits-canadian-courier-divisions,Canada,?,C,?,Other,Transportation,"TFI International in a ransomware attack lost USD 6 million just from having to resort to manual sorting, and subsequently had data posted to the dark web when it refused to pay the ransom",28/04/2021,19/08/2020
83,[84],N/A,https://www.haywood.k12.nc.us/blog/2020/09/01/update-on-ransomware-attack/,US,?,C,?,Education,Education,"Haywood County Schools in North Carolina were forced to close following an attack. In a statement released by the school, it was disclosed that school staff discovered the incident and that the third-party attacker has requested a ransom to stop the attack.",01/09/2020,24/08/2020
84,[85],N/A,https://www.inquirer.com/transportation/septa-malware-attack-employees-riders-app-announcements-20200824.html,US,?,C,?,Other,Transportation (Authority),Southeastern Pennsylvania Transportation Authority (SEPTA) were unable to provide real-time transportation information after an attack caused their systems to fail.,24/08/2020,10/08/2020
85,[86],N/A,https://www.thestar.com/business/2020/08/25/canadian-real-estate-company-brookfield-residential-suffers-data-breach-by-new-ransomware-group-darkside.html,Canada,DarkSide(?),C,DarkSide (?),Other,Real estate development,"Brookfield Residential Properties , the home construction division of one of Canadaï¿½s largest publicly-traded companies, was next to fall victim to an attack. Although the organization did not confirm that the attack was ransomware, a threat group known as DarkSide claimed the attack and threatened to release stolen data unless a ransom was paid.",25/08/2020,10/08/2020
86,[87],N/A,https://www.databreaches.net/ar-gosnell-schools-hit-with-ransomware-attack/,US,?,C,?,Education,Education,Gosnell School District in Arkansas. Little has been reported about the attack but it was disclosed that ransomware software infiltrated the schoolï¿½s system and at the time of writing personal data had not been compromised.,26/08/2020,23/08/2020
87,[88],N/A,https://www.crn.com/news/security/ma-labs-ransomware-attack-shakes-up-components-industry,US,Revil/Sodinokibi,C,ReEvil/Sodinokibi,Technology,Technology/Computer Componants,"California based MA LABS, one of the leading computer component distributors in the United States was the next company to make the list. The REvil ransomware gang claim to have exfiltrated 949 gigabytes of confidential information from the central servers of the company. Company failed to notify there clients and the public, the company also asked for payment via email which is a major red flag",31/08/2020,10/08/2020
88,[89],N/A,https://kmph.com/news/local/selma-unified-hit-with-ransomware-attack ,US,?,C,?,Education,Education,"Fresno, California where back to school was disrupted when a ransomware attack took down the entire network at the Selma Unified School District forcing Fresno-area schools to cancel online classes. One of the programs held was a student information system. ",28/08/2020,28/08/2020
89,[90],N/A,https://www.itwire.com/security/australian-firm-tandem-corp-hit-by-windows-netwalker-ransomware.html ,Australia,Netwalker,C,Netwalker,Logistics,Commercial and residential sectors,"Workforce design and delivery firm Tandem Corp became a victim of NetWalker ransomware. Screenshots of data allegedly stolen during the attack were published on the Dark Web. The screenshots included files which appeared to contain financial data, personnel information and passport details.",02/09/2020,02/09/2020
90,[91],N/A,https://www.miamiherald.com/news/local/community/florida-keys/article245467410.html,US,?,L,?,Government,Government,Staff at Key West City Hall were forced to go back to pen and paper when a ransomware attack took their systems offline.,03/09/2020,03/09/2020
91,[92],N/A,https://techcrunch.com/2020/09/03/cygilant-ransomware/?guccounter=1&guce_referrer=aHR0cHM6Ly93d3cubXNzcGFsZXJ0LmNvbS8&guce_referrer_sig=AQAAAHHae_RT0Il19PTfxP0sj_e_naQjApg7OcSshjvc5FfmUo8fiCVibtYWrg6LNFGIHlWxSt7resbuHU2l6U6kdEpMdRec_L4uv8VroFIy0fd4H2EdnjlK9k58vRBE0RyxDxdpOIBbMUdic8t_DemqhBG10YvhLFGoeUyUMkjfOVu8,US,Netwalker,C,Netwalker ,Technology,Cybersecurity/ IT Security,Cygilant hit by Netwalker attack and confirmed by CFO. Impacted a portion of the companys Technologyenviorment. ,04/09/2020,03/09/2020
92,[93],N/A,https://www-argentina-gob-ar.translate.goog/noticias/migraciones-contuvo-un-intento-de-ciberataque?_x_tr_sl=es&_x_tr_tl=en&_x_tr_hl=en-GB&_x_tr_pto=nui ,Argentina,Netwalker,C,Netwalker,Other,Law Enforcement,Netwalker attack on Argentina immegration Direcciï¿½n Nacional de Migraciones. The attack stopped border crossing into the country and ransom doubled from 2 to 4 million,06/09/2020,27/07/2020
93,[94],N/A,https://www.bleepingcomputer.com/news/security/netwalker-ransomware-hits-argentinian-government-demands-4-million/,Chile,Revil/Sodinokibi,C,ReEvil/Sodinokibi,Finance,Finance,"A REvil attack on BancoEstado in Chile. The bank, which is one of Chileï¿½s three largest, was forced to close all of its branches following the attack.",07/09/2020,05/09/2020
94,[95],N/A,https://www.hartfordschools.org/hps-opening-postponed-tuesday-sept-8/ ,US,?,L,?,Education,Education,The ransomware attack disrupted the first day back to school for students of Hartford Public Schools in Connecticut when hackers knocked their critical systems offline over Labor Day weekend.,08/09/2020,06/09/2020
95,[96],N/A,https://www.bbc.co.uk/news/uk-england-tyne-54047179,UK,DopplePaymer,C,DopplePaymer,Education,Education,Newcastle university affected by DopplePaymer group. the DoppelPaymer group has been posting documents it claims to have stolen from its servers to its dedicated ï¿½Doppel Leaksï¿½ site.,04/09/2020,10/09/2020
96,[97],N/A,https://blog.equinix.com/blog/2020/09/09/equinix-statement-on-security-incident/,US,?,C,?,Technology,Technology/Internet ,Equinix was the next firm to reveal they had been hit with a ransomware attack. The organization confirmed that its data centers and managed Servicesremained intact as it was only internal systems affected.,09/09/2020,09/09/2020
97,[98],N/A,https://www.bangkokpost.com/thailand/general/1983211/1-9bn-to-help-combat-cyber-breaches-at-hospitals ,Thailand,?,C,?,Healthcare,Healthcare,Ransomware attack on the hospital ransomware was detected after it entered the system on Sept 5 at 5.31am. The attacker demanded a ransom of 63 billion baht in Bitcoin to be paid in exchange for unlocking the system.,10/09/2020,05/09/2020
98,[99],N/A,https://ain.ua/2020/09/01/softserve-haknuli/,Ukraine,?,C,?,Technology,Technology/ Software development,software developer and IT Servicesprovider SoftServe suffered a ransomware attack that may have led to the theft of customers source code.,01/09/2020,01/09/2020
99,[100],N/A,https://techmonitor.ai/techonology/cybersecurity/conti-ransomware-court,US,Conti,C,Conti,Government,Government/ Admnistration ,"The Fourth District Court of Louisiana suffered a Contiattack , a relatively new ransomware strain. The administrative infrastructure of the courts was affected which led to the website being breached and internal documents being posted online.",11/09/2020,11/09/2020
100,[101],N/A,https://dcist.com/story/20/09/13/fairfax-county-public-schools-ransomware-attack/,US,Maze(?),C,Maze(?),Education,Education,"Students in Fairfax County Public Schools, Virginiaï¿½s largest school system were forced to begin the new school year with remote learning after a ransomware attack affected its systems. The hack reportedly didnï¿½t impact distance learning or personal devices but data has now been published",09/10/2020,09/09/2020
101,[102],N/A,https://www.manitoulin.com/manitoulin-transport-gore-bay-face-down-ransomware-demands/,Canada,Conti(?),C,Conti(?),Logistics,Transportand logistics/ Trucking,"Manitoulin Transport, one of Canadaï¿½s largest trucking companies was the next to disclose that they had become the latest victim of attacks targeting firms in Canadaï¿½s supply chain. The Contigang posted stolen data but following discussions with the hackers the firm decided not to pay as the information stolen in the attack wasnï¿½t important.",11/09/2020,31/07/2020
102,[103],N/A,https://www.cybersecurity-insiders.com/ransomware-attack-on-manitoulin-transport/ ,Netherlands,?,C,?,Government,Government, Veiligheidsregio Noord- en Oost-Gelderland (VNOG) in the Netherlands. The attack damaged internal systems and it is still unclear who was behind it.,14/09/2020,12/09/2020
103,[104],N/A,https://www.cbs.sc/Downloads/Pressrelease/CBS%20closely%20monitoring%20DBS%E2%80%99%20report%20of%20a%20ransomware%20attack%20on%20its%20network.pdf ,Seychelles,?,C,?,Finance,Finance/Banking,The Development Bank of Seychelles (DBS) was next to find themselves a ransomware victim. DBS is a joint venture by the Seychelles Governmentand several shareholders and at the time of writing they were reportedly unclear about how the attack occurred and the damage was still being assessed.,11/09/2020,09/09/2020
104,[105],N/A,https://www.bleepingcomputer.com/news/security/netwalker-ransomware-hits-pakistans-largest-private-power-utility/ ,Pakistan,Netwalker,C,Netwalker,Other,Energy ,"K-Electric, the sole power distributor in Karachi, Pakistan experienced a ransomware attack by the Netwalker gang. The attack led to the disruption of the power utilityï¿½s billing and online Servicesand the attackers requested a ransom of $3.8 million.",08/09/2020,07/09/2020
105,[106],N/A,https://eu.greatfallstribune.com/story/news/education/2020/09/15/great-falls-public-schools-work-recover-network-ransomware-attack/5805453002/ ,US,Conti(?),C,Conti(?),Education,Education,"Great falls public school. The school district shut down most of its systems to investigate and recover from the attack. At the time of writing they were working with the department of Justice, the National Guard, FBI and Otherprivate consultants to remedy the problem and were yet to disclose where the attack came from or what the attackers were requesting as a ransom.",16/09/2020,16/09/2020
106,[108],N/A,https://abc7.com/ransomware-attack-newhall-school-district-cyber/6424803/ ,US,?,L,?,Education,Education,Newhall School District in California were next to find themselves victimized by ransomware. The attack locked up the systems and led to the cancellation of remote classes as students where told not to log on to the learning systems or use any district device.,16/09/2020,15/09/2020
107,[109],N/A,https://www.rtl.de/cms/hacker-angriff-auf-uniklinik-duesseldorf-starb-eine-patientin-wegen-einer-erpressung-4615184.html ,Germany,?,C,?,Healthcare,Health,Duesseldorf University Hospital in Germanysuffered an attack which meant they were unable to accept emergency patients. Sadly this resulted in a loss of life with from Covid-19 after a patient was re-routed to anOtherfacility 20 miles away. A German news outlet reported that the cyberattack was not intended for the hospital and that the ransom note was addressed to a nearby university. The attackers stopped the attack after authorities told them it had actually shut down a hospital.,17/09/2020,16/09/2020
108,[110],N/A,https://www.bleepingcomputer.com/news/security/leading-us-laser-developer-ipg-photonics-hit-with-ransomware/,US,RansomEXX,C,RansomEXX,Technology,Technology/  Semiconductor Equipment & Materials,"Massachusetts based IPG Photonics, a leading developer of fiber lasers for cutting, welding, medical use, and laser weaponry was next to suffer a ransomware attack. It was reported that RansomExx was behind the attack that shut down the IT systems worldwide, affecting email, phones, and network connectivity in the offices.",18/09/2020,18/09/2020
109,[111],N/A,https://www.cbc.ca/news/canada/london/college-of-nurses-ontario-cyber-security-incident-1.5727816 ,Canada,?,C,?,Education,Education,"Canada next where Ontarioï¿½s College of Nurses , the organization that oversees 188,000 members, was next to be hit by an attack. At the time of reporting it was disclosed that personal information may have been impacted but a ransom demand had not yet been received.",17/09/2020,08/09/2020
110,[112],N/A,https://www.bleepingcomputer.com/news/security/new-jersey-hospital-paid-ransomware-gang-670k-to-prevent-data-leak/ ,US,SunCrypt,C,SunCrypt,Healthcare,Health ," University Hospital in New Jersey. It was reported that the institution suffered a massive 48,000 document data breach after the ransomware operation leaked their stolen data. The SunCrypt ransomware gang claimed to be responsible for the attack.",03/10/2020,15/09/2020
111,[113],N/A,https://www.theboltonnews.co.uk/news/18736384.sixth-form-bolton-hackers-steal-data-ransomware-attack/ ,UK,?,C,?,Education,Education,"Sixth Form College in Bolton, UK was the next reported incident in the Educationsector. Post attack the college engaged a specialist team to launch an investigation and mitigate the impact. At time of writing the forensic investigation was ongoing but it was confirmed that some data had been exfiltrated",22/09/2020,17/09/2020
112,[114],N/A,https://www.techradar.com/news/ray-ban-parent-company-reportedly-suffers-ransomware-attack ,Italy,?,C,?,Retail,Retail/ Clothing/ Eyewear distribution,"Italy based Luxottica, the parent company of Ray Ban made the headlines next. The organization reported widespread service outages but claimed that no customer data had been stolen in the incident.",23/09/2020,22/09/2020
113,[115],N/A,https://ia.acs.org.au/article/2020/anglicare-hit-by-ransomware.html,Australia,?,C,?,Healthcare,Social services/ Age care,"Anglicare Sydney, a not-for-profit that provides social Servicessuch as aged care was next to report they had been hit by a ransomware attack that saw attackers exfiltrate 17GB of data.",22/09/2020,21/09/2020
114,[116],N/A,https://heimdalsecurity.com/blog/the-tyler-technology-ransomware-attack-overview/,US,RansomExx(?),C,RansomExx (?),Technology,Technology/Software," Tyler Technologies, the largest provider of software to the United States public sector disclosed that they had become a victim of an attack that affected their internal systems",17/06/2021,23/09/2020
115,[117],N/A,https://lloydslist.maritimeintelligence.informa.com/LL1134044/CMA-CGM-confirms-ransomware-attack,France,Ragnar Locker,C,Ragnar Locker,Logistics,Transport/ Container shipping,"French carrier CMA CGM became the latest big name in container shipping to reveal it had become a victim of ransomware, The Ragnar Locker ransomware gang instructed them to make contact within two days via live chat to pay for the ransom key.",28/09/2020,27/09/2020
116,[118],N/A,https://ir.uhsinc.com/news-releases/news-release-details/universal-health-services-inc-reports-2020-fourth-quarter-and,US,Ryuk(?),C,Ryuk(?),Healthcare,Healthcare,"Universal Health Services, one of the largest Healthcareproviders in the United States was next to be hit by a ransomware attack. Its speculated that the Ryukgang was behind the attack and details of how widespread the issue is are still unknown.",01/03/2021,27/09/2020
117,[119],N/A,https://www.ccsd.net/district/dataincident/,US,?,C,?,Education,Education," Clark County School District in Las Vegas. The attack which activated at the end of August triggered a data breach involving Social Security numbers, student information and Otherprivate information according to the Wall Street Journal.",28/09/2020,27/08/2020
118,[120],N/A,https://www.insurancebusinessmag.com/uk/news/cyber/gallagher-hit-by-ransomware-attack-servers-disabled-234875.aspx,US,?,C,?,Finance,Finance/ Insurance,International insurance brokerage firm Arthur J. Gallagher & Co. The company confirmed that the attack had occurred on September 26th and that the incident impacted a ï¿½limited portionï¿½ of its internal systems. ,30/09/2020,26/09/2020
119,[121],N/A,https://www.group-ib.com/media/oldgremlin/,Russia,OldGremlin,C,OldGremlin,Finance,Finance/Banks,"On September 23, 2020, Group-IB reported that a cybercrime gang dubbed 'OldGremlin' had been targeting banks and Otherbusinesses in Russia with ransomware since early March, 2020.",23/09/2020,23/09/2020
120,[122],N/A,https://www.nytimes.com/2020/10/03/technology/clinical-trials-ransomware-attack-drugmakers.html ,US,?,C,?,Healthcare,Health,"eResearchTechnology(ERT) where a ransomware attack disrupted clinical trials being run to develop tests, treatments, and a vaccine for COVID-19.",21/04/2021,05/10/2020
121,[123],N/A, https://www.insurancebusinessmag.com/uk/news/cyber/ardonagh-cyber-breach--new-report-sheds-light-on-reach-235542.aspx,UK,?,C,?,Finance,Finance/ Insurance brokers ,"Ardonagh Group. According to reports from The Register, the firm was forced to suspend 200 internal accounts with admin privileges as the incident progressed through its IT estate.",07/10/2020,30/10/2020
122,[124],N/A,https://www.freightwaves.com/news/ransomware-hackers-claims-attack-on-texas-customs-broker ,US,Conti(?),C,Conti(?),Logistics,Logistics/ Freight,"Texas based customs broker and freight forwarder Daniel B. Hastings. The company, who specialize in U.S.-Mexico cross-border shipments didnï¿½t comment on the attack, but the exfiltrated company files were posted online from the Contiransomware gang.",07/10/2020,03/10/2020
123,[125],N/A,https://www.gainesvilletimes.com/news/government/hall-county-government-email-phone-services-down/,US,?,C,?,Government,Government,"Hall County Governmentin Georgia was the next victim. While officials didnï¿½t release details of how the attack happened or what was being done to resolve it, Itï¿½s thought that no employee or resident data had been compromised.",13/10/2020,07/09/2020
124,[126],N/A,https://www.bleepingcomputer.com/news/security/massachusetts-school-district-shut-down-by-ransomware-attack/,US,?,C,?,Education,Edcuation,"With over 25,000 students, 4500 employees and 60 schools, the Springfield Public Schools district is the third largest school district in Massachusetts. Once the attack was identified the district shut down all systems and closed the schools to prevent spread of the attack.",08/10/2020,07/10/2020
125,[127],N/A,https://www.zdnet.com/article/german-tech-giant-software-ag-down-after-ransomware-attack/,US,Clop,C,Clop,Technology,Technology,"Software AG, one of the largest software companies in the world suffered an attack from the Clop ransomware gang who demanded more than $20 million. After negotiations failed the Clop gang published screenshots of the companyï¿½s data on the Dark Web.",09/10/2020,03/10/2020
126,[128],N/A,https://www.freightwaves.com/news/truckers-personal-information-exposed-after-daseke-ransomware-attack,US,Conti,C,Conti,Logistics,Logistics,UStrucking company Daseke became a victim of the Contiransomware gang next. Thousands of internal documents exposing the personal information of their drivers and Othersensitive data was posted to the Dark Web.,09/10/2020,07/10/2020
127,[129],N/A,https://www.itnews.com.au/news/spotless-hit-by-ransomware-attack-554554 ,Australia,?,C,?,Services,Services,Australian based facilities Servicesprovider Spotless Group was the next company to hit the headlines when a number of their servers were compromised in a ransomware attack. ,12/10/2020,09/10/2020
128,[130],N/A,https://www.cybersecurity-insiders.com/mississippi-school-pays-300000-for-ransomware-attack/,US,?,C,?,Education,Education,"Yazoo County School District in Mississippi. Following the attack, the school took its IT systems offline and engaged a cybersecurity firm to help recover data encrypted by threat actors. The school board voted to pay $300,000 to recover the data that was encrypted by malware.",19/10/2020,12/10/2020
129,[131],N/A,https://www.bleepingcomputer.com/news/security/crytek-hit-by-egregor-ransomware-ubisoft-data-leaked/  ,Germany,Egregor,C/RaaS,Egregor,Technology,Technology/ Video Games,"German based game developer Crytek suffered an attack at the hands of the Egregorransomware gang. In addition to encrypting the devices, the gang claims they have stolen unencrypted files from Crytek and have leaked a 380MB archive on their data leak site.",15/10/2020,13/10/2020
130,[132],N/A,https://eu.lohud.com/story/news/education/2020/10/15/yorktown-croton-harmon-schools-suffer-cybersecurity-attacks/3668883001/,US,?,C,?,Education,Education,"New York based Yorktown and Croton-Harmon schools both reported cybersecurity attacks. Croton-Harmon confirmed the incident was a ransomware attack, however Yorktown did not confirm the attack was indeed ransomware.",15/10/2020,14/10/2020
131,[133],[7],https://www.13abc.com/2020/10/16/i-team-investigation-major-tps-data-breach-exposes-personal-information-of-students-staff/ ,US,Maze,C,Maze,Education,Education,"Toledo Public Schools (TPS) was next report an incident. The district confirmed that a cyberattack had occurred in September but they were unaware that data had been compromised. It has since been confirmed that Maze ransomware was responsible for the attack and more than nine gigabytes of data were dumped which included social security numbers, addresses and more for employees as well as current and former students.",16/10/2020,09/09/2020
132,[134],N/A,https://timesofindia.indiatimes.com/city/noida/haldirams-hit-by-ransomware-attack-hackers-asked-for-7-5l/articleshow/78712465.cms ,India,?,C,?,Manufacturing,Manufacturing,"Indiabased snacks manufacturer Haldiramï¿½s experienced a ransomware attack on its servers. Hackers left a message on all affected Servicesconfirming it was a ransomware attack and that all data, files, applications and systems had been encrypted and a ransom would have to be paid to release the data.",17/10/2020,17/07/2020
133,[135],N/A,https://www.fullyloaded.com.au/logistics-news/2010/containerchain-wards-off-ransomware-attack-over-weekend  ,Australia,?,C,?,Logistics,Logistics,Australiabased container Logisticsplatform Containerchain. According to the firm they quickly identified the ransomware cyberattack and immediately implemented an emergency response procedure resulting in limited data loss and downtime.,19/10/2020,16/10/2020
134,[136],N/A,https://www.turnto23.com/news/local-news/city-of-shafter-hit-with-ransomware-attack,US,?,C,?,Government,Government,The City of Shafter in California announced that its IT system has been compromised by ransomware. In an Instagram post they revealed that the cityï¿½s IT system appeared to be frozen and locked.,20/10/2020,19/10/2020
135,[137],N/A,https://www.uppermichiganssource.com/2020/10/20/dickinson-county-healthcare-system-responding-to-malware-attack/  ,US,?,C,?,Healthcare,Healthcare,Dickinson County Healthcaresystem were the victim of an attack that distrupted access to computer systems across its hospitals and clinics. ,20/10/2020,17/10/2020
136,[138],N/A,https://www.tripwire.com/state-of-security/security-data-protection/montreal-public-transport-agency-discloses-ransomware-attack/,Canada,RansomEXX(?),C,RansomEXX (?),Transport,Transport,Next came Montreal public Transportagency The Sociï¿½tï¿½ de Transportde Montrï¿½al (STM). Hackers demanded a ransom of US$2.8m to restore normal network operations but according to the agency no data was exfiltrated and they were not intending to pay the ransom.,21/10/2020,19/10/2020
137,[139],N/A,https://newsday.co.tt/2020/10/21/hack-attack-2/,Trinidad and Tobago,ReEvil,C,ReEvil/Sodinokibi,Manufacturing,Manufacturing,"The Caribbeanï¿½s largest conglomerate, Ansa McAl became the victim of REvil ransomware. Itï¿½s understood that work at Tatil, the countryï¿½s biggest insurer was stalled for two weeks as the IT department works to find and expel the ransomware from the companyï¿½s servers.",21/10/2020,19/10/2020
138,[140],N/A,https://www.railwaygazette.com/technology-data-and-business/boston-commuter-operator-hit-by-ransomware-attack/57616.article,US,?,C,?,Logistics,Logistics,On the same day hackers attacked Boston commuter operator Keolis Commuter Services. The companyï¿½s threat detection systems alerted the operator who managed to deactivate its network within a few hours.,21/10/2020,10/10/2020
139,[141],N/A,https://www.businesswire.com/news/home/20201021005846/en/,France,Maze(?),C,Maze(?),Technology,Technology,French-headquartered IT outsourcer Sopra Steria was next to be struck by a cyberattack. At time of reporting the business declined to say what had happened but French media reports indicated that Sopra Steriaï¿½s Active Directory infrastructure had been compromised by hackers linked to the Ryukmalware gang,21/10/2020,20/10/2020
140,[142],N/A,https://www.thenomadtoday.com/articulo/finland/scandal-over-the-hijack-and-and-publication-of-private-mental-health-data/20201023141903008599.html,Finland,?,C,?,Healthcare,Health,"Hackers hijacked and published the mental health records of hundreds of patients from Finland based psychotherapy center Vastaamo. Hackers demanded 450,000 Euros in exchange for ceasing publication of the data which included that of minors",23/10/2020,23/10/2020
141,[143],N/A,https://www.businessinsider.in/tech/news/indian-news-agency-hit-by-massive-ransomware-attack-servers-were-down-for-hours-but-no-payment-was-made/articleshow/78873646.cms,India,LockBit,C/RaaS,?,Education,Education,Indian news agency Press Trust of India(PTI) was hit by a massive ransomware attack which shut its servers down for hours. The attack disrupted operations and the delivery of news to subscribers but no ransom was paid.,26/10/2020,23/10/2020
