ID,Ref,RefrenceInTechnicalReport,RefrenceURL,Country,RansomwareName,RansomwareType,Group,Sector,SectorDetailed,Description,ArticleDate,AttackDate
142,[144],N/A,https://siliconangle.com/2020/10/26/golf-ski-resort-operator-boyne-resorts-struck-ransomware-attack/,US,WastedLocker,C,Evil Corp (?),Services,Services,Michigan based golf and ski resort operator Boyne Resorts was hit by a WastedLocker attack that forced the company to shut down parts of its network. As a result of the attack customers were unable to make online reservations when the booking system was knocked offline.,26/10/2020,23/10/2020
143,[145],N/A,https://www.bleepingcomputer.com/news/security/steelcase-furniture-giant-hit-by-ryuk-ransomware-attack/,US,Ryuk(?),C,Ryuk(?),Services,Services/Manufacturing,"Steelcase Furniture, anOtherMichigan based company was next to be hit. Steelcase is the largest office furniture manufacturer globally, with 13,000 employees and $3.7 billion in revenues. The Ryukgang is thought to be behind the attack which forced the shutdown of their network.",27/10/2020,22/10/2020
144,[146],N/A,https://kobi5.com/news/cyber-attack-reportedly-hits-sky-lakes-medical-center-139416/,US,Ryuk,C,Ryuk,Healthcare,Health,"Sky Lakes Medical Center in Klamath Falls Oregon was victimized by the Ryukransomware gang. The attack took computer systems offline and forced clinicians to switch to pen and paper to record patient information. No evidence has been found to indicate patient information was compromised, although the Ryukgang is known to exfiltrate patient data prior to file encryption.",27/10/2020,27/10/2020
145,[147],N/A,https://www.bleepingcomputer.com/news/security/enel-group-hit-by-ransomware-again-netwalker-demands-14-million/ ,Italy,Netwalker,C,Netwalker,Utilities,Utilities/ Energy,Multinational energy company Enel Group were hit by ransomware for the second time this year. The Netwalker gang demanded a $14 million ransom for the decryption key and to not release several terabytes of stolen data. ,27/10/2020,19/10/2020
146,[148],N/A,https://www.nny360.com/news/stlawrencecounty/update-three-st-lawrence-county-hospitals-hit-by-ransomware-attack-tuesday/article_01778d25-333e-567b-8e03-6581fa571a37.html  ,US,?,C,?,Healthcare,Health,"Lawrence Health System in New York were forced to divert ambulances at three area hospitals after a ransomware attack. The three hospitals hit included Canton-Potsdam Hospital, Gouverneur Hospital and Massena Hospital.",27/10/2020,27/10/2020
147,[149],N/A,https://www.theguardian.com/technology/2020/oct/27/cyberattack-strikes-media-monitoring-company-used-by-australian-government,Australia,?,C,?,Technology,Technology,Next we head to Australiawhere media monitoring company Insentia became the next victim. Most Governmentdepartments and large corporations in the country are clients of the firm.,27/10/2020,27/10/2020
148,[150],N/A,https://www.databreaches.net/sodinokibi-ransomware-group-hits-the-hanover-chamber-of-crafts/,Germany,Sodinokibi,C,Sodinokibi,Government,Government,The networks of the Hanover Chamber of Crafts experienced ransomware attacks at all four of its locations as well as the wholly owned subsidiary Projekt- und Servicegesellschaft. The Sodinokibi ransomware gang was responsible for the attack.,28/10/2020,26/10/2020
149,[151],N/A,https://timesofindia.indiatimes.com/city/hyderabad/dr-reddys-admits-to-ransomware-attack-says-still-restoring-data-investigating-origin/articleshow/78921019.cms ,India,?,C,?,Healthcare,Healthcare,Indian company Dr Reddyï¿½s Laboratories admitted to a ransomware attack following a cyberattack earlier this month. They donï¿½t believe the attack is connected with the Russian Covid-19 vaccine Sputnik V. that Dr Reddyï¿½s plans to distribute in India.,29/10/2020,22/10/2020
150,[152],N/A,https://www.beckershospitalreview.com/cybersecurity/inside-uvm-medical-center-s-ransomware-attack-11-details.html  ,Canada,Ryuk,C,Ryuk,Healthcare,Healthcare,University of Vermont Health Network as the next victum of Ryuk. An anonymoUSsource who spoke to the press stated that as many as 20 medical facilities have been hit by the recent wave of ransomware. The figure includes multiple facilities within the same hospital chain.,23/12/2020,28/10/2020
151,[153],N/A,https://www.forbes.com/sites/leemathews/2020/10/31/ransomware-gang-claims-international-casino-equipment--supplier-as-latest-victim/?sh=fb3daff68b20,US,ReEvil,C,Revil,Other,Consumer discretionay,"international casino equipment supplier Gaming Partners International became a victim of the REvil gang. According to a recent interview with a Russian tech blog, REvil hacked and encrypted all servers and working computers at the company.",31/10/2020,30/10/2020
152,[154],N/A,https://sonomasun.com/2020/12/15/sonoma-valley-hospital-notifies-patients-affected-by-ransomware-attack/,US,?,C,?,Healthcare,Health,Sonoma Valley Hospital confirmed that its system-wide computer shutdown in October was due to a ransomware attack. Hackers demanded a ransom to release data but at time of writing the hospital had not paid the ransom. The attack was likely part of the Russia backed campaign that recently targeted as may has 400 Healthcareorganizations across the US.,15/12/2020,11/10/2020
153,[155],N/A,https://www.bleepingcomputer.com/news/security/capcom-hit-by-ragnar-locker-ransomware-1tb-allegedly-stolen/,Japan,Ragnar Locker,C,Ragnar Locker,Technology,Technology,"Japanese game developer Capcom fell victim to an attack at the hands of the Ragnar Locker gang who claimed to have stolen 1TB of sensitive data from their corporate networks in the US, Japan, and Canada. The ransom note included screenshots of stolen files, including employee termination agreements, passports, sales reports and bank statements.",05/11/2020,02/11/2020
154,[156],N/A,https://www.thespiritsbusiness.com/2020/11/campari-hack-leads-to-data-loss/ ,Italy,Ragnar Locker(?),C,Ragnar Locker (?),Other,Beverage,Italian beverage giant Campari Group was the next big-name brand to suffer an attack. An investigation into the attack is ongoing and some researchers suspect the Ragnar Locker gang is responsible.,10/11/2020,01/11/2020
155,[157],N/A,https://www.zdnet.com/article/brazilian-superior-electoral-court-hit-by-major-cyberattack/ ,Brazil,RansomExx(?),C,RansomExx (?),Government,Government/ Law,Massive ransomware attack that affected the cyberinfrastructure of the Brazilian Superior Court of Justice (STJ). The ransomware operators behind the attack claimed that the entire STJ database has been encrypted and any attempt to restore the files would be in vain.,06/11/2020,03/11/2020
156,[158],N/A,https://eandt.theiet.org/content/articles/2020/11/private-prison-firm-hit-with-ransomware-attack/,US,?,C,?,Government,Government,"The GEO Group, the company best known for operating illegal immigration detention centres and private prisons in the USwere next to disclose that they had been victim of an attack earlier in the year. The attack exposed sensitive inmate and resident information.",06/11/2020,19/08/2020
157,[159],N/A,https://www.zdnet.com/article/compal-the-second-largest-laptop-manufacturer-in-the-world-hit-by-ransomware/ ,Taiwan,DopplePaymer,C,DopplePaymer,Technology,Technology,"Taiwanese electronics giant Compal, was next to make the ransomware headlines. The company who builds laptops for some of the worldï¿½s largest computer brands suffered an attack at the hands of the DoppelPaymer gang. The attack is said to have impacted around 30% of Compalï¿½s computer fleet.",09/11/2020,06/11/2020
158,[160],N/A,https://www.databreachlawyers.co.uk/news/flagship-group-cyberattack-caused-bhttps://www.bbc.co.uk/news/uk-england-norfolk-55057547 ,UK,Sodinokibi,C,Sodinokibi,Services,Services/House Provider,UK based housing association Flagship Group were forced to take their IT systems offline after the Sodinokibi ransomware strain entered the company via a phishing attack. ,24/11/2020,01/11/2020
159,[161],N/A,https://www.hipaajournal.com/ransomware-attack-on-medicaid-billing-service-provider-impacts-116000-individuals/,US,?,C,?,Healthcare,Health/ Medical billing,Iowa based medical billing company Timberline Billing Service LLC is boosting its cybersecurity after an unknown attack encrypted files and exfiltrated data earlier in the year.,11/11/2020,10/11/2020
160,[162],N/A,https://www.bleepingcomputer.com/news/security/biotech-research-firm-miltenyi-biotec-hit-by-ransomware-data-leaked/,Germany,Mount Locker,C,Ragnar Locker (?),Healthcare,Health/ Biomedical,"Biomedical and clinical research company Miltenyi Biotec suffered a Mount Locker attack that affected the firmï¿½s global IT infrastructure. The companyï¿½s 2,500 employees from 28 countries are working to develop cell research and therapy products for clinicians and researchers working on covid-19 vaccines.",13/11/2020,01/11/2020
161,[163],N/A,https://www.sec.gov/ix?doc=/Archives/edgar/data/1455863/000119312520294943/d62059d8k.htm,US,?,C,?,Healthcare,Health,"AnOthercompany hit with a cyber attack is Americold, which is a cold storage giant responsible for providing storage for the distribution of COVID-19 vaccines.",16/11/2020,16/11/2020
162,[164],N/A,https://www.bleepingcomputer.com/news/security/retail-giant-cencosud-hit-by-egregor-ransomware-attack-stores-impacted/,Chile,Egergor,C,Egregor,Retail,Retail,Chilean-based multinational Retailgiant Cencosud was hit by an EgregorRansomware attack that impacted Servicesacross its stores,14/11/2020,13/11/2020
163,[165],N/A,https://www.cbc.ca/news/canada/new-brunswick/saint-john-attack-was-ransonware-1.5805531,Canada,?,C,?,Government,Government,The City of Saint John in Canada was next to confirm that a recent cyberattack against them was indeed ransomware. Officials have declined to say how much money was demanded by the attackers or what systems had been affected.,17/11/2020,13/10/2020
164,[166],N/A,https://www.wfmz.com/news/area/lehighvalley/northampton-area-public-library-hit-by-ransomware-attack/article_b0eb423c-2915-11eb-9ced-73450f56a94b.html,US,?,C,?,Services,Services,Lehigh Valley Library in Pennsylvania was forced to close after falling victim to an attack. Affected servers were taken offline and the library remained closed while the attack was investigated and systems were restored.,17/11/2020,16/11/2020
165,[167],N/A,https://nexia.com.au/news/nexia-melbourne-defends-and-contains-ransomware-attack,Australia,ReEvil,C,ReEvil,Finance,Accountancy/Consultancy,"Nexia Australiaand New Zealand, a network of solutions-focused accountancy and consultancy firms were next to disclose that they had been hit by REvil ransomware. The attackers claimed to have stolen 76GB of data during the incident, however, Nexia denied this and said that the incident was swiftly dealt with by their IT providers and there was no evidence of any movement of data or files.",16/11/2020,03/11/2020
166,[168],N/A,https://www.infosecurity-magazine.com/news/oregon-county-hit-by-ransomware/,US,?,C,?,Government,Government,"Governmentattack is next, this time its Jackson County in Oregon. The attack downed the countyï¿½s website following the recent ransomware attack on their web-hosting service provider, Managed.com",19/11/2020,16/11/2020
167,[169],N/A,https://www.koreatimes.co.kr/www/tech/2020/11/694_299692.html ,South Korea ,?,C,?,Retail,Retail,South Korean fashion and Retailcompany E-Land was forced to shut down 23 of its 50 branches following a ransomware attack,22/11/2020,22/11/2020
168,[170],N/A,https://www.dailymail.co.uk/sport/sportsnews/article-8989881/Manchester-United-held-RANSOM-cyberhackers-control-computers.html,UK,?,C,?,Other,Sports,"Manchester United Football Club made serioUSheadlines this month when it was revealed that they had suffered a cyberattack. Later confirmed to be ransomware, the club disclosed that although the attack was sophisticated, they had extensive protocols and procedures in place for such an event and they were prepared",26/11/2020,20/11/2020
169,[171],N/A,https://www.lawinorder.com.au/news-events/law-in-order-cyber-security-incident,Australia,Netwalker,C,Netwalker,Services,Services," Law In Order, an Australian supplier of document and digital Servicesto law firms. The company were victims of the Netwalker ransomware gang.",03/12/2020,22/11/2020
170,[172],N/A,https://www.bleepingcomputer.com/news/security/danish-news-agency-ritzau-refuses-to-pay-after-ransomware-attack/,Denmark,?,C,?,Education,Education/Services,"Ritzau, the largest independent news agency in Denmark responsible for delivering news to virtually all major media in in the country, had their editorial systems shut down following a ransomware attack. In a statement they confirmed that they did not intend to pay the ransom.",25/11/2020,24/11/2020
171,[173],N/A,https://www.beckershospitalreview.com/cybersecurity/us-fertility-ransomware-attack-exposes-patient-info-4-details.html US ,US,?,C,?,Healthcare,Health,"USFertility, a network of fertility clinics was hit by a ransomware attack that compromised patient information. A security incident had been identified in September after some devices on the network became inaccessible.",27/11/2020,14/09/2020
172,[174],N/A,https://www.bleepingcomputer.com/news/security/iot-chip-maker-advantech-confirms-ransomware-attack-data-theft/ ,US,Conti,C,Conti,Technology,Technology,"Advantech, the industrial automation and IoT chip maker confirmed that a ransomware attack that hit its network and that company data had been exfiltrated. The attack was carried out by the Contiransomware gang who demanded a $14 million ransom to decrypt the affected systems and to stop leaking stolen company data.",30/11/2020,21/11/2020
173,[175],N/A,https://www.bleepingcomputer.com/news/security/pennsylvania-county-pays-500k-ransom-to-doppelpaymer-ransomware/ ,US,DopplePaymer,C,DopplePaymer,Government,Government,Delaware County in Pennsylvania were the next reported victim of the DoppelPaymer gang. Systems were taken offline while the organization worked with computer forensic specialists to determine the nature and scope of the event.,29/11/2020,20/11/2020
174,[176],[8],https://www.dailymail.co.uk/news/article-8997501/Baltimore-County-Public-Schools-closed-Monday-Tuesday-ransomware-attack.html ,US,?,C,?,Education,Education,"Baltimore Public Schools was forced to cancel online learning for its 115,000 students after a ransomware affected its systems",29/11/2020,16/11/2020
175,[177],N/A,https://siliconangle.com/2020/11/29/dopplepaymer-ransomware-targets-big-brother-producer-endemol-shine/,Netherlands,?,C,?,Other,Television Production,"Endemol Shine, the global production company behind television shows such as ï¿½Big Brother,ï¿½ ï¿½MasterChefï¿½ and ï¿½The Voiceï¿½. The company has disclosed that they have reason to believe personal employee data and commercially sensitive information may have been compromised.The attack is claimed by DopplePaymer",29/11/2020,26/11/2020
176,[2],N/A,https://www.bleepingcomputer.com/news/security/k12-online-schooling-giant-pays-ryuk-ransomware-to-stop-data-leak,US,Ryuk,C,Ryuk,Education,Education,RyukRansomware attack on K-12 schools to avoid data leak,02/12/2020,15/11/2020
177,[178],N/A,https://vancouver.citynews.ca/2020/12/03/translink-suspicious-activity-response/,Canada,Egregor,C,Egregor,Transport,Transport,Vancouverï¿½s transportation network Translink were next to disclose they had been a victim of ransomware at the hands of the Egregorgang,03/12/2020,03/12/2020
178,[179],N/A,https://siliconangle.com/2020/12/03/kmart-allegedly-struck-egregor-ransomware-attack/ ,US,Egregor,C,Egregor,Retail,Retail,"Next is anOtherEgregorattack, this time on USretailer Kmart. The attack resulted in a number of servers on its network becoming encrypted. A ransom note showed that an HR website used by the store had also been brought offline by the hackers",03/12/2020,01/12/2020
179,[180],N/A,https://www.zdnet.com/article/hackers-leak-data-from-embraer-worlds-third-largest-airplane-maker/,Brazil,RansomExx,C,RansomExx,Manufacturing,Manufacturing,Brazilian aerospace giant Embraer reported that they had been a victim of ransomware. The company chose to restore its affected systems and refused to negotiate with the attackers which promoted the RansomExx gang to leak some company data.,07/12/2020,25/11/2020
180,[181],N/A,https://www.bleepingcomputer.com/news/security/largest-global-staffing-agency-randstad-hit-by-egregor-ransomware/,UK,Egregor,C,Egregor,Other,HR Services,"Randstad, the worldï¿½s largest staffing agency was the next reported victim of the Egregorgang. Unencrypted files were stolen during the attack and a subset of the data was later published.",04/12/2020,04/12/2020
181,[182],N/A,https://www.indulgexpress.com/gadgets/2020/dec/05/reportswiss-helicopter-maker-kopter-hit-by-a-ransomware-attack-30070.html,Switzerland,LockBit,C,LockBit,Manufacturing,Manufacturing,Swiss helicopter manufacturer Kopter fell victim to the LockBit gang who encrypted the companyï¿½s files and published a subset of them after they refused to engage,05/12/2020,04/12/2020
182,[183],N/A,https://baltimore.cbslocal.com/2020/12/18/gbmc-ransomware-cyberattack-nurse-speaks-latest/,US,?,C,?,Healthcare,Health,Greater Baltimore Medical Center (GBMC HealthCare) was hit by a ransomware attack that impacted its computer systems and operations,18/12/2020,08/12/2020
183,[184],N/A,https://www.indulgexpress.com/gadgets/2020/dec/05/reportswiss-helicopter-maker-kopter-hit-by-a-ransomware-attack-30070.html,Mexico,DopplePaymer,C,DopplePaymer,Technology,Technology,Electronics giant Foxconn suffered a ransomware attack at a Mexican facility during the Thanksgiving break. Following the attack the DoppelPaymer ransomware gang published files belonging to Foxconn NA on their ransomware data leak site.,07/12/2020,28/11/2020
184,[185],N/A,https://blocksandfiles.com/2020/12/09/airgapped-defence-helps-schools-in-ransomware-attack/,UK,Sodinokibi,C,Sodinokibi,Education,Education,"Haberdashersï¿½ Monmouth Schools , an independent schools group in Wales was hit by the Sodinokibi ransomware gang. The hackers deleted files belonging to staff and pupils and encrypted onsite backups.",09/12/2020,27/09/2020
185,[186],N/A,https://www.govtech.com/security/independence-mo-recovering-after-ransomware-attack.html,US,?,C,?,Government,Government,The town of Independence Missouri revealed that they had been a victim of a ransomware attack that resulted in technical difficulties and disruption to multiple Servicesbut it had been halted before the full city network had been infected,09/12/2020,05/12/2020
186,[187],N/A,https://www.pymnts.com/news/security-and-risk/2020/tsys-attacked-with-ransomware-has-data-posted-online/,US,Conti,C,Conti,Services,Service,the Contigang claimed responsibility for the attack on Georgia based payment processing company TSYS. The attackers claimed to have published over 10 gigabytes of TSYS data but the company said the attack only impacted itï¿½s administrative wing and not any payment data. TSYS did not confirm if any ransom had been paid.,10/12/2020,08/12/2020
187,[188],N/A,https://www.bleepingcomputer.com/news/security/intels-habana-labs-hacked-by-pay2key-ransomware-data-stolen/,US,Pay2Key,C,Pay2Key,Technology,Technology,Intel-owned AI processor developer Habana Labs suffered an attack at the hands of the Pay2Key ransomware operation. The hackers leaked company data and in a threat posted to their leaked data site they stated that Habana Labs had 72hrs to stop the data leaking process.,13/12/2020,13/12/2020
188,[189],N/A,https://www.itwire.com/security/auto-services-firm-inchcape-hit-by-windows-ransomexx-ransomware.html ,Australia,RansomExx,C,RansomExx,Manufacturing,Manufacturing/ Automotive services,Australian automotive Servicesprovider Inchcape became the next victim of RansomEXX. The gang leaked data on the Dark Web following the attack.,14/12/2020,14/12/2020
189,[190],N/A,https://eu.usatoday.com/story/travel/cruises/2020/12/15/norway-cruise-line-hurtigruten-hit-comprehensive-cyberattack/3901485001/,Norway,?,C,?,Transport,Transport,Norwegian cruise company Hurtigruten disclosed that its systems had been hit by a significant ransomware attack in which the cruise lines global IT infrastructure had been affected. At time of writing itï¿½s not known who was behind the attack,15/12/2020,14/12/2020
190,[191],N/A,https://www.bleepingcomputer.com/news/security/flavors-designer-symrise-halts-production-after-clop-ransomware-attack/ ,Germany,Clop,C,Clop ,Other,Chemicals,Germanybased flavor and fragrance developer Symrise were forced to halt production following an attack claimed by the Clop ransomware gang. The attackers allegedly stole 500 GB of unencrypted files and encrypted close to 1000 devices. ,20/12/2020,19/12/2020
191,[192],N/A,https://www.freightwaves.com/news/news-alert-forward-air-reveals-ransomware-attack-warns-of-revenue-hit ,US,Hades,C,Hades,Logistics,Logistics,Trucking and Logisticsfirm Forward Air revealed they had been targeted by a ransomware attack and warned that it may defer or lose revenue as a result. This attack is the first we have recorded for the Hades ransomware group. ,21/12/2020,15/12/2020
192,[193],N/A,https://www.sangoma.com/press-releases/sangoma-technologies-confirms-data-breach-as-result-of-ransomware-attack/ ,Canada,Conti,C,Conti,Technology,Technology,Canadian voice over IP hardware and software maker Sangoma Technologies were struck by a ransomware attack involving the Contigang. ,27/12/2020,24/12/2020
193,[194],N/A,https://www.bleepingcomputer.com/news/security/home-appliance-giant-whirlpool-hit-in-nefilim-ransomware-attack/ ,US,Nefilim,C,Nefilim,Retail,Retail,Home appliance giant Whirlpool suffered a ransomware attack by the Nefilim gang who stole data before encrypting their devices.  ,28/12/2020,27/12/2020
194,[195],[9],https://www.brusselstimes.com/news/belgium-all-news/147433/antwerp-laboratory-becomes-latest-victim-of-cyber-attack/,Belgium,Clop,C,Clop,Healthcare,Health ,"General Medical Laboratory (AML) in Antwerp, a laboratory working closely on the management of the Covid-19 pandemic suffered an attack by the Clop ransomware gang",29/12/2020,28/12/2020
195,[196],N/A,https://www.businesswire.com/news/home/20201218005029/en/GenRx-Pharmacy-Issues-Data-Security-Incident-Notice,US,?,C,?,Healthcare,Health,Arizona-based Healthcareorganization GenRx Pharmacy issued a warning to patients over a potential data breach following a ransomware attack earlier in the year. ,18/12/2020,08/09/2020
196,[197],N/A,https://www.stuff.co.nz/business/industries/123831316/hackers-publish-client-data-stripped-from-auckland-financial-services-company-on-dark-web,New Zealand,Netwalker,C,Netwalker,Finance,Finance,New Zealand based financial Servicesfirm Staircase Financial Management were the next company to be hit.  A post on the NetWalker blog had a countdown clock indicating how much time was left before the data was made public. That clock has since run out and the data was made public across multiple third party file sharing sites.,30/12/2020,29/12/2020
197,[198],N/A,https://www.cbc.ca/news/canada/manitoba/peter-nygard-bail-ransomware-attack-1.5859131 ,Canada,Netwalker,C,Netwalker,Finance,Financials,The court-appointed receiver of Canadian company Nygardï¿½s assets confirmed that Nygard was a victim of a ransomware attack in a Dec 30th court document. IT staff identified the ransomware responsible as Netwalker. The initial ransom demand was approximately 99 bitcoins ï¿½ equivalent to more than $3.6 million but this rose to 198 bitcoins ï¿½ equivalent to more than $7.2 million when the company failed to respond.,30/12/2020,14/12/2020
198,[199],N/A,https://www.lrhc.org/news/releases/public-statement-from-lrh-ceo-kent-mattson-about-ransomware-attack/ ,US,?,C,?,Healthcare,Health,Lake Region Healthcarewere affected by a ransomware attack.  In a statement released on Dec 30,30/12/2020,22/12/2020
199,[200],N/A,https://www.bitdefender.com/blog/hotforsecurity/israel-shaken-by-data-leak-after-ransomware-attack-at-shirbit-insurance-company,Israel,BlackShadow ,C,BlackShadow,Finance,Financal Services,"Shirbit, an Israeli-based insurance company, was hit by a ransomware attack that appears to be the work of the hacker group BlackShadow.",07/12/2020,01/12/2020
200,[201],N/A,https://www.constructionnews.co.uk/contractors/amey/amey-hit-by-cyber-attack-05-01-2021/,UK,?,C,Ragnar Locker,Manufacturing,Infrastructure,UK-based infrastructure support service provider Amey. The company was targeted by the Mount Locker ransomware gang in mid-December.,05/01/2021,15/12/2020
201,[203],N/A,https://www.abc.net.au/news/2021-01-11/ransomware-attack-nt-government-phishing-attempts/13036472,Australia,?,C,C,Government,Government,The Northern Territory Governmentin Australiawas next to reveal an attack that forced its systems offline for 3 weeks,01/01/2021,10/01/2021
202,[204],N/A,https://www.freightwaves.com/news/ransomware-attack-hits-short-line-rail-operator-omnitrax,US,Conti,C,Conti,Logistics,Logistics,"Colorado-based rail operator and Logisticsprovider OmniTRAX was hit by a ransomware attack that targeted its corporate parent company, Broe Group. ",09/01/2021,08/01/2021
203,[205],N/A,https://www.fishfarmermagazine.com/news/akva-targeted-by-ransomware-hackers/ ,Norway,?,C,?,Technology,Technology,"Norway based AKVA Group, a global supplier of Technologyto the aquaculture industry revealed that they had been hit by a ransomware attack and that hackers were demanding a ransom.",12/01/2021,10/01/2021
204,[206],N/A,https://ago.vermont.gov/blog/2020/12/30/dassault-falcon-jet-corp-notice-of-data-breach-to-consumers/,US,Ragnar Locker,C,Ragnar Locker,Manufacturing,Manufacturing,"Dassault Falcon Jet Corp, the USsubsidiary of Dassault Aviation, suffered a ransomware attack at the hands of the Ragnar Locker gang.",30/12/2020,06/12/2020
